{
  "name": "prb-avg",
  "desc": "Calculates the arithmetic average of x and y, as 18 decimal fixed point, rounding down.",
  "operand": 0,
  "inputs": {
    "parameters": [
      {
        "name": "x"
      },
      {
        "name": "y"
      }
    ]
  },
  "outputs": 1,
  "aliases": ["decimal18-avg"]
}
