{
  "name": "any",
  "desc": "Inserts the first non-zero value of all the values it checks if there exists one, else inserts zero into the stack.",
  "operand": [
    {
      "name": "inputs",
      "bits": [0, 7],
      "validRange": [[2, 255]]
    }
  ],
  "inputs": {
    "bits": [0, 7],
    "parameters": [
      {
        "name": "input",
        "spread": true
      }
    ]
  },
  "outputs": 1,
  "aliases": ["or"]
}
