{
  "name": "verify-v1-account-status-at-time",
  "desc": "The status of an account at a specific time from a VerifyV1.",
  "operand": 0,
  "outputs": 1,
  "inputs": {
    "parameters": [
      {
        "name": "verify-v1-address"
      },
      {
        "name": "account-address"
      },
      {
        "name": "timestamp"
      }
    ]
  },
  "aliases": ["verify-v1-account-status"]
}
