{
  "name": "scale-n",
  "desc": "Rescale an 18 OOMs fixed point number to scale N.",
  "operand": [
    {
      "name": "target-decimals",
      "desc": "The target decimals to scale to.",
      "bits": [2, 15],
      "validRange": [[0, 16383]]
    },
    {
      "name": "saturate",
      "desc": "If 1 scaling up will saturate rather than overflow past uint256 max.",
      "bits": [1, 1],
      "validRange": [[0, 1]]
    },
    {
      "name": "round-up",
      "desc": "If 1 scaling down will round up rather than down on precision loss.",
      "bits": [0, 0],
      "validRange": [[0, 1]]
    }
  ],
  "inputs": {
    "parameters": [
      {
        "name": "value",
        "desc": "The value to scale to N"
      }
    ]
  },
  "outputs": 1
}
