{
  "name": "erc-721-owner-of",
  "desc": "Get the owner of an ERC721 token of an account and insert it into the stack",
  "operand": 0,
  "inputs": {
    "parameters": [
      {
        "name": "token-address"
      },
      {
        "name": "token-id"
      }
    ]
  },
  "outputs": 1,
  "aliases": ["erc-721-owner"]
}
