{
  "name": "every",
  "desc": "Inserts the first value of all the values it checks if all of them are non-zero, else inserts zero into the stack.",
  "operand": [
    {
      "name": "inputs",
      "bits": [0, 7],
      "validRange": [[2, 255]]
    }
  ],
  "inputs": {
    "bits": [0, 7],
    "parameters": [
      {
        "name": "input",
        "spread": true
      }
    ]
  },
  "outputs": 1,
  "aliases": ["and"]
}
