{
  "name": "read-memory",
  "desc": "Takes an item from constants array or from stack items and insert it into the stack",
  "operand": [
    {
      "name": "index",
      "desc": "index of the item to read",
      "bits": [1, 15]
    },
    {
      "name": "type",
      "desc": "type of the read, from constants or stack",
      "bits": [0, 0]
    }
  ],
  "inputs": 0,
  "outputs": 1,
  "aliases": ["read"]
}
