{
  "name": "equal-to",
  "desc": "Compares the last 2 items of the stack together and inserts true/1 into stack if they are euqal, else inserts false/0",
  "operand": 0,
  "inputs": {
    "parameters": [
      {
        "name": "value1"
      },
      {
        "name": "value2"
      }
    ]
  },
  "outputs": 1,
  "aliases": ["eq"]
}
