{
  "name": "add",
  "desc": "Adds multiple values together. Values can be either decimal or integer, but not a mix of both.",
  "operand": [
    {
      "name": "inputs",
      "bits": [0, 7],
      "validRange": [[2, 255]]
    }
  ],
  "inputs": {
    "bits": [0, 7],
    "parameters": [
      {
        "name": "input",
        "spread": true
      }
    ]
  },
  "outputs": 1,
  "aliases": ["sum", "int-add", "decimal18-add", "int-sum", "decimal18-sum"]
}
