{
  "name": "prb-gm",
  "desc": "Calculates the geometric mean of x and y, as 18 decimal fixed point i.e. $$sqrt(x * y)$$, rounding down.",
  "operand": 0,
  "inputs": {
    "parameters": [
      {
        "name": "x"
      },
      {
        "name": "y"
      }
    ]
  },
  "outputs": 1,
  "aliases": ["decimal18-gm"]
}
